{
  "$schema": "https://json-schema.org/draft/2020-12/schema",
  "$id": "https://easynet.run/sdk/schemas/events-invocation-subscription-request.schema.json",
  "title": "InvocationEventQuery",
  "type": "object",
  "additionalProperties": false,
  "required": [
    "caller_ura",
    "callee_ura",
    "subject_ura",
    "descriptor_version",
    "nonce_base64",
    "causal_context",
    "stream",
    "invocation_id"
  ],
  "properties": {
    "caller_ura": {"type": "string", "minLength": 1},
    "callee_ura": {"type": "string", "minLength": 1},
    "subject_ura": {"type": "string", "minLength": 1},
    "descriptor_version": {"type": "string", "minLength": 1},
    "nonce_base64": {"type": "string", "minLength": 1},
    "causal_context": {"type": "object"},
    "stream": {"const": "invocation"},
    "filter": {
      "type": "object",
      "additionalProperties": false,
      "properties": {
        "invocation_id": {"type": "string", "minLength": 1}
      }
    },
    "invocation_id": {"type": "string", "minLength": 1},
    "resume_cursor": {
      "oneOf": [
        {"type": "null"},
        {
          "type": "object",
          "additionalProperties": false,
          "required": ["stream", "sequence"],
          "properties": {
            "stream": {"const": "invocation"},
            "sequence": {"type": "integer", "minimum": 0},
            "token": {"type": "string", "minLength": 1}
          }
        }
      ]
    },
    "metadata": {"type": "object"}
  }
}
