{
  "caller_ura": "easynet:///r/example/agent/alice.sdk",
  "callee_ura": "easynet:///r/example/device/dev-a",
  "subject_ura": "easynet:///r/example/device/dev-a",
  "descriptor_version": "1.0.0",
  "nonce_base64": "AQIDBAUGBwgJCgsMDQ4PEA==",
  "causal_context": {
    "form": "none"
  },
  "stream": "invocation",
  "invocation_id": "inv-1",
  "resume_cursor": {
    "stream": "invocation",
    "sequence": 9
  },
  "metadata": {
    "request_id": "events-invocation-subscribe-1"
  }
}
